{
  "$schema": "https://creel.dev/schema/graph/v1",
  "directed": true,
  "edges": [
    {
      "attributes": {
        "marker": 1
      },
      "id": "addresses:project-prj-001->cross-cutting-area-environment:1",
      "source": "project:prj-001",
      "target": "cross_cutting_area:environment",
      "type": "addresses"
    },
    {
      "attributes": {
        "marker": 2
      },
      "id": "addresses:project-prj-002->cross-cutting-area-gender-equality:0",
      "source": "project:prj-002",
      "target": "cross_cutting_area:gender-equality",
      "type": "addresses"
    },
    {
      "attributes": {},
      "id": "assesses:0",
      "source": "reading:ind-1-total-total-national-2026-q2",
      "target": "output:op-1-1",
      "type": "assesses"
    },
    {
      "attributes": {},
      "id": "assesses:1",
      "source": "reading:ind-1-female-total-national-2026-q2",
      "target": "output:op-1-1",
      "type": "assesses"
    },
    {
      "attributes": {},
      "id": "assesses:2",
      "source": "reading:ind-1-male-total-national-2026-q2",
      "target": "output:op-1-1",
      "type": "assesses"
    },
    {
      "attributes": {},
      "id": "assesses:3",
      "source": "reading:ind-2-total-total-national-2026-q2",
      "target": "output:op-2-1",
      "type": "assesses"
    },
    {
      "attributes": {},
      "id": "assesses:4",
      "source": "reading:ind-2-female-total-national-2026-q2",
      "target": "output:op-2-1",
      "type": "assesses"
    },
    {
      "attributes": {},
      "id": "contributes_to:0",
      "source": "output:op-1-1",
      "target": "outcome:oc-1",
      "type": "contributes_to"
    },
    {
      "attributes": {},
      "id": "contributes_to:1",
      "source": "output:op-2-1",
      "target": "outcome:oc-2",
      "type": "contributes_to"
    },
    {
      "attributes": {},
      "id": "delivers:0",
      "source": "project:prj-001",
      "target": "output:op-1-1",
      "type": "delivers"
    },
    {
      "attributes": {},
      "id": "delivers:1",
      "source": "project:prj-002",
      "target": "output:op-2-1",
      "type": "delivers"
    },
    {
      "attributes": {
        "amount": 2500000,
        "currency": "EUR",
        "transaction_type": "disbursement"
      },
      "id": "funds:donor-agency-beta->project-prj-002:1",
      "source": "donor:agency-beta",
      "target": "project:prj-002",
      "type": "funds"
    },
    {
      "attributes": {
        "amount": 3000000,
        "currency": "USD",
        "transaction_type": "commitment"
      },
      "id": "funds:donor-foundation-alpha->project-prj-001:0",
      "source": "donor:foundation-alpha",
      "target": "project:prj-001",
      "type": "funds"
    },
    {
      "attributes": {
        "amount": 1500000,
        "currency": "USD",
        "transaction_type": "commitment"
      },
      "id": "funds:donor-foundation-alpha->project-prj-002:2",
      "source": "donor:foundation-alpha",
      "target": "project:prj-002",
      "type": "funds"
    },
    {
      "attributes": {},
      "id": "measures:0",
      "source": "reading:ind-1-total-total-national-2026-q2",
      "target": "indicator:ind-1",
      "type": "measures"
    },
    {
      "attributes": {},
      "id": "measures:1",
      "source": "reading:ind-1-female-total-national-2026-q2",
      "target": "indicator:ind-1",
      "type": "measures"
    },
    {
      "attributes": {},
      "id": "measures:2",
      "source": "reading:ind-1-male-total-national-2026-q2",
      "target": "indicator:ind-1",
      "type": "measures"
    },
    {
      "attributes": {},
      "id": "measures:3",
      "source": "reading:ind-2-total-total-national-2026-q2",
      "target": "indicator:ind-2",
      "type": "measures"
    },
    {
      "attributes": {},
      "id": "measures:4",
      "source": "reading:ind-2-female-total-national-2026-q2",
      "target": "indicator:ind-2",
      "type": "measures"
    }
  ],
  "nodes": {
    "cross_cutting_area:environment": {
      "attributes": {
        "name": "Environment"
      },
      "types": [
        "cross_cutting_area"
      ]
    },
    "cross_cutting_area:gender-equality": {
      "attributes": {
        "name": "Gender Equality"
      },
      "types": [
        "cross_cutting_area"
      ]
    },
    "donor:agency-beta": {
      "attributes": {
        "name": "Agency Beta",
        "org_code": "918"
      },
      "types": [
        "donor"
      ]
    },
    "donor:foundation-alpha": {
      "attributes": {
        "name": "Foundation Alpha",
        "org_code": "301"
      },
      "types": [
        "donor"
      ]
    },
    "indicator:ind-1": {
      "attributes": {
        "measure": "number",
        "name": "Number of people with access to clean water"
      },
      "types": [
        "indicator"
      ]
    },
    "indicator:ind-2": {
      "attributes": {
        "measure": "percentage",
        "name": "Percentage of households with adequate housing"
      },
      "types": [
        "indicator"
      ]
    },
    "outcome:oc-1": {
      "attributes": {
        "statement": "Communities have sustained access to clean water"
      },
      "types": [
        "outcome"
      ]
    },
    "outcome:oc-2": {
      "attributes": {
        "statement": "Households live in adequate and dignified housing"
      },
      "types": [
        "outcome"
      ]
    },
    "output:op-1-1": {
      "attributes": {
        "statement": "Water systems rehabilitated and operational"
      },
      "types": [
        "output"
      ]
    },
    "output:op-2-1": {
      "attributes": {
        "statement": "Housing kits distributed to households"
      },
      "types": [
        "output"
      ]
    },
    "project:prj-001": {
      "attributes": {
        "code": "PRJ-001",
        "title": "Water Access"
      },
      "types": [
        "project"
      ]
    },
    "project:prj-002": {
      "attributes": {
        "code": "PRJ-002",
        "title": "Housing Support"
      },
      "types": [
        "project"
      ]
    },
    "reading:ind-1-female-total-national-2026-q2": {
      "attributes": {
        "actual": 2200,
        "age_group": "total",
        "baseline": 500,
        "location": "national",
        "period": "2026-Q2",
        "sex": "female",
        "target": 2500
      },
      "types": [
        "reading"
      ]
    },
    "reading:ind-1-male-total-national-2026-q2": {
      "attributes": {
        "actual": 2000,
        "age_group": "total",
        "baseline": 500,
        "location": "national",
        "period": "2026-Q2",
        "sex": "male",
        "target": 2500
      },
      "types": [
        "reading"
      ]
    },
    "reading:ind-1-total-total-national-2026-q2": {
      "attributes": {
        "actual": 4200,
        "age_group": "total",
        "baseline": 1000,
        "location": "national",
        "period": "2026-Q2",
        "sex": "total",
        "target": 5000
      },
      "types": [
        "reading"
      ]
    },
    "reading:ind-2-female-total-national-2026-q2": {
      "attributes": {
        "actual": 70,
        "age_group": "total",
        "baseline": 20,
        "location": "national",
        "period": "2026-Q2",
        "sex": "female",
        "target": 85
      },
      "types": [
        "reading"
      ]
    },
    "reading:ind-2-total-total-national-2026-q2": {
      "attributes": {
        "actual": 65,
        "age_group": "total",
        "baseline": 20,
        "location": "national",
        "period": "2026-Q2",
        "sex": "total",
        "target": 80
      },
      "types": [
        "reading"
      ]
    }
  },
  "spec": {
    "id": "rbm",
    "version": "0.1.0"
  },
  "version": "1.0"
}
